{"$schema":"packages/course-v2/schemas/ground-v2.schema.json","bounds":{"maxEasting":680451.5,"maxHeightRH2000":44.8740119934082,"maxNorthing":6626324.5,"minEasting":678403.5,"minHeightRH2000":9.880691528320312,"minNorthing":6624276.5},"frame":{"axisMapping":{"worldX":"easting - originEasting","worldY":"heightRH2000 - originHeightRH2000","worldZ":"originNorthing - northing"},"compoundCrs":"EPSG:5845","fingerprint":"3b6db48a9134351129c33ee0e167aa1f5a295f9724f1e3a42ab797a2153209d4","horizontalCrs":"EPSG:3006","origin":{"easting":679427.5,"heightRH2000":9.88,"northing":6625300.5},"verticalCrs":"EPSG:5613"},"groundFormat":2,"groundId":"johannesberg","requiredFeatures":["chunk-envelope-v2","object-registry-json-v1","stand-field-u8-v1","terrain-grid-u16-v1"],"schemaVersion":2,"shell":{"bytes":98877,"decodedBytes":132098,"decodedSha256":"68ed5f876fe6cc8a37696ecdd61ed03639f29bdbd5ff1ed23f9805d7b8ef0542","kind":"terrain","mediaType":"application/vnd.banvy.chunk-v2","requiredFeatures":["chunk-envelope-v2","terrain-grid-u16-v1"],"sha256":"f01999eabd467477019d50094e89da29e9c019c8d6bfbaef12091c351114845b","url":"grounds/johannesberg/terrain/f01999eabd467477019d50094e89da29e9c019c8d6bfbaef12091c351114845b.bvch"},"sourceManifestSha256":"27b89de4e1400f22d0d0b9d477738875ccbaa7726e16557a9c50b9392086c84c","tiles":[{"bounds":{"maxEasting":678659.5,"maxHeightRH2000":14.760000000000002,"maxNorthing":6626324.5,"minEasting":678403.5,"minHeightRH2000":10.270000000000001,"minNorthing":6626068.5},"courses":["johannesberg"],"geometricErrorMetres":0.005,"id":"l0/0/0","layers":{"objects":{"bytes":890,"decodedBytes":545,"decodedSha256":"32a57876c1887d16aca6515ab1ed5588e2e3d7e0099c4d7f0a2747a030ef6924","kind":"objects","mediaType":"application/vnd.banvy.chunk-v2","requiredFeatures":["chunk-envelope-v2","object-registry-json-v1"],"sha256":"0b48f34a1725a2536a79a94a72f16cb7c9d7a64552fd28ca023dff5912df5504","url":"grounds/johannesberg/objects/0b48f34a1725a2536a79a94a72f16cb7c9d7a64552fd28ca023dff5912df5504.bvch"},"stands":{"bytes":1000,"decodedBytes":16384,"decodedSha256":"6e40b9f2935dab2f5cc7936ab79559e919816f1f69282dce8c7872ce816b7cf4","kind":"stands","mediaType":"application/vnd.banvy.chunk-v2","requiredFeatures":["chunk-envelope-v2","stand-field-u8-v1"],"sha256":"eb7741c1bc676020f74b7588a801867164d3d07ae103355b2f7b999127c312ff","url":"grounds/johannesberg/stands/eb7741c1bc676020f74b7588a801867164d3d07ae103355b2f7b999127c312ff.bvch"},"surface":null,"terrain":{"bytes":54612,"decodedBytes":132098,"decodedSha256":"d7fafecffff475940596a0433cf5011e2ddde9ccb65e03de3cf055bcff07f62c","kind":"terrain","mediaType":"application/vnd.banvy.chunk-v2","requiredFeatures":["chunk-envelope-v2","terrain-grid-u16-v1"],"sha256":"6d0db4ddc3c54090655fc57bb16da072311b8209f37af886b9f07bf9b9b49301","url":"grounds/johannesberg/terrain/6d0db4ddc3c54090655fc57bb16da072311b8209f37af886b9f07bf9b9b49301.bvch"}},"lod":0},{"bounds":{"maxEasting":678915.5,"maxHeightRH2000":30.96,"maxNorthing":6626324.5,"minEasting":678659.5,"minHeightRH2000":10.270000000000001,"minNorthing":6626068.5},"courses":["johannesberg"],"geometricErrorMetres":0.005,"id":"l0/1/0","layers":{"objects":{"bytes":1790,"decodedBytes":11792,"decodedSha256":"45ca59189425dcf8f65c33d5f2e7260c330c6c83e0490f02617cbf05d27c50f8","kind":"objects","mediaType":"application/vnd.banvy.chunk-v2","requiredFeatures":["chunk-envelope-v2","object-registry-json-v1"],"sha256":"797c549af8c6ba49abfb6ae4411bee536a33aad191beb60a9176881b2e4b5061","url":"grounds/johannesberg/objects/797c549af8c6ba49abfb6ae4411bee536a33aad191beb60a9176881b2e4b5061.bvch"},"stands":{"bytes":2416,"decodedBytes":16384,"decodedSha256":"5e780df72a0d109b4050fec8353c8257ddd2e895977db412a41aebdec3b801f4","kind":"stands","mediaType":"application/vnd.banvy.chunk-v2","requiredFeatures":["chunk-envelope-v2","stand-field-u8-v1"],"sha256":"8159d1af4067a311b37fb352cfd113a11c1a39bbf18f0a16f111149f7a5cc62e","url":"grounds/johannesberg/stands/8159d1af4067a311b37fb352cfd113a11c1a39bbf18f0a16f111149f7a5cc62e.bvch"},"surface":null,"terrain":{"bytes":82554,"decodedBytes":132098,"decodedSha256":"8af9f0a7f08c6f19940ad6409bc45394c7e3ae34561a350db4e7c7afb7756512","kind":"terrain","mediaType":"application/vnd.banvy.chunk-v2","requiredFeatures":["chunk-envelope-v2","terrain-grid-u16-v1"],"sha256":"0768a6af2fb9ce4f0dc32bc6379c1199285f605d9ba56e1e8b48c30373d5ef50","url":"grounds/johannesberg/terrain/0768a6af2fb9ce4f0dc32bc6379c1199285f605d9ba56e1e8b48c30373d5ef50.bvch"}},"lod":0},{"bounds":{"maxEasting":679171.5,"maxHeightRH2000":22.55,"maxNorthing":6626324.5,"minEasting":678915.5,"minHeightRH2000":11.120000000000001,"minNorthing":6626068.5},"courses":["johannesberg"],"geometricErrorMetres":0.005,"id":"l0/2/0","layers":{"objects":{"bytes":1505,"decodedBytes":8048,"decodedSha256":"7242ef0b6c65791426a001b0a04f0f8791b4ea7e70f5a0db78b7ff55363dfc3f","kind":"objects","mediaType":"application/vnd.banvy.chunk-v2","requiredFeatures":["chunk-envelope-v2","object-registry-json-v1"],"sha256":"b2ad56d31df19be9e6d898703c9b692f31af738a4218486393e4f1ca8facddcd","url":"grounds/johannesberg/objects/b2ad56d31df19be9e6d898703c9b692f31af738a4218486393e4f1ca8facddcd.bvch"},"stands":{"bytes":1981,"decodedBytes":16384,"decodedSha256":"4b2844167464ff41226423cfaba1bbce752a64c98ed4e451098adcb5854dfe08","kind":"stands","mediaType":"application/vnd.banvy.chunk-v2","requiredFeatures":["chunk-envelope-v2","stand-field-u8-v1"],"sha256":"1540e24aee38393a1c10770b4585106c1b901e241f23bbd8fc026a59fdbe77af","url":"grounds/johannesberg/stands/1540e24aee38393a1c10770b4585106c1b901e241f23bbd8fc026a59fdbe77af.bvch"},"surface":null,"terrain":{"bytes":67233,"decodedBytes":132098,"decodedSha256":"0d8e03e4faf2bcb0442317e772b5f08b68d8d58591f1627251cd6d00e7c79ce7","kind":"terrain","mediaType":"application/vnd.banvy.chunk-v2","requiredFeatures":["chunk-envelope-v2","terrain-grid-u16-v1"],"sha256":"f1e7cae61ba1ed86fd022841d39af1af9fdb491402da6c661a047f6c695be171","url":"grounds/johannesberg/terrain/f1e7cae61ba1ed86fd022841d39af1af9fdb491402da6c661a047f6c695be171.bvch"}},"lod":0},{"bounds":{"maxEasting":679427.5,"maxHeightRH2000":28.53,"maxNorthing":6626324.5,"minEasting":679171.5,"minHeightRH2000":10.790000000000001,"minNorthing":6626068.5},"courses":["johannesberg"],"geometricErrorMetres":0.005,"id":"l0/3/0","layers":{"objects":{"bytes":1638,"decodedBytes":9456,"decodedSha256":"b16aa75f2893f038188f9a262dd28e05c60ad6e476da4e0270ced07b56a493e3","kind":"objects","mediaType":"application/vnd.banvy.chunk-v2","requiredFeatures":["chunk-envelope-v2","object-registry-json-v1"],"sha256":"ddc6503bae5b4c0ae1fbcb5abcbd76a07a57990fe3a40b6e1b39f76ea73a15e4","url":"grounds/johannesberg/objects/ddc6503bae5b4c0ae1fbcb5abcbd76a07a57990fe3a40b6e1b39f76ea73a15e4.bvch"},"stands":{"bytes":2866,"decodedBytes":16384,"decodedSha256":"268782cc5412efca325864f0f6b91d020abc047c62aef2d0f5ca95c35122a087","kind":"stands","mediaType":"application/vnd.banvy.chunk-v2","requiredFeatures":["chunk-envelope-v2","stand-field-u8-v1"],"sha256":"1acc2a67c80d16de76c71012dc2424b09323d295af1b0034d7b70e49934b4338","url":"grounds/johannesberg/stands/1acc2a67c80d16de76c71012dc2424b09323d295af1b0034d7b70e49934b4338.bvch"},"surface":null,"terrain":{"bytes":84648,"decodedBytes":132098,"decodedSha256":"6eb9b5f90ad58c396e3930b48aabb1f88a23bd4449b98dee0944c311a2412a18","kind":"terrain","mediaType":"application/vnd.banvy.chunk-v2","requiredFeatures":["chunk-envelope-v2","terrain-grid-u16-v1"],"sha256":"0d28f947e5eb4f83b422d6bf96e4c24dc64e8a77de99e08a2f1e8f7edf7521ed","url":"grounds/johannesberg/terrain/0d28f947e5eb4f83b422d6bf96e4c24dc64e8a77de99e08a2f1e8f7edf7521ed.bvch"}},"lod":0},{"bounds":{"maxEasting":679683.5,"maxHeightRH2000":32.57,"maxNorthing":6626324.5,"minEasting":679427.5,"minHeightRH2000":12.81,"minNorthing":6626068.5},"courses":["johannesberg"],"geometricErrorMetres":0.005,"id":"l0/4/0","layers":{"objects":{"bytes":2530,"decodedBytes":21632,"decodedSha256":"0779dca3df5575583469a425078757aefd2a00e6a9d41a8c39318661149b12e5","kind":"objects","mediaType":"application/vnd.banvy.chunk-v2","requiredFeatures":["chunk-envelope-v2","object-registry-json-v1"],"sha256":"2213c37b1ce75805a5fe538e7d808f1dd457ef0cb413a5965b821b7390196a57","url":"grounds/johannesberg/objects/2213c37b1ce75805a5fe538e7d808f1dd457ef0cb413a5965b821b7390196a57.bvch"},"stands":{"bytes":4470,"decodedBytes":16384,"decodedSha256":"e781e1cc25516128210d1a07acaf2b60d2ce8a3ea37fe0522b3394f3718e1e17","kind":"stands","mediaType":"application/vnd.banvy.chunk-v2","requiredFeatures":["chunk-envelope-v2","stand-field-u8-v1"],"sha256":"b3f8de371469f85a56693a87e1c357ae048767c3ea15bd057c0ab66f223db298","url":"grounds/johannesberg/stands/b3f8de371469f85a56693a87e1c357ae048767c3ea15bd057c0ab66f223db298.bvch"},"surface":null,"terrain":{"bytes":86555,"decodedBytes":132098,"decodedSha256":"c383f95d4002219aecb3a389c6306eb8bf044ab7705bcbe2891d58b7eed2f6e3","kind":"terrain","mediaType":"application/vnd.banvy.chunk-v2","requiredFeatures":["chunk-envelope-v2","terrain-grid-u16-v1"],"sha256":"6c46fcbab9dfbec77e4d568f93eb2a42a5ad26652295df16eb9ccb008447aac6","url":"grounds/johannesberg/terrain/6c46fcbab9dfbec77e4d568f93eb2a42a5ad26652295df16eb9ccb008447aac6.bvch"}},"lod":0},{"bounds":{"maxEasting":679939.5,"maxHeightRH2000":40.14,"maxNorthing":6626324.5,"minEasting":679683.5,"minHeightRH2000":11.170000000000002,"minNorthing":6626068.5},"courses":["johannesberg"],"geometricErrorMetres":0.005,"id":"l0/5/0","layers":{"objects":{"bytes":2988,"decodedBytes":28648,"decodedSha256":"0548e29a9194d1590b4cb5ae644810ba05794be86c95d795384ebbefe3c79208","kind":"objects","mediaType":"application/vnd.banvy.chunk-v2","requiredFeatures":["chunk-envelope-v2","object-registry-json-v1"],"sha256":"37eeeeac5aa53027ad3055d1f94f37ff06ed7fae8668a8255fc5184d3e541128","url":"grounds/johannesberg/objects/37eeeeac5aa53027ad3055d1f94f37ff06ed7fae8668a8255fc5184d3e541128.bvch"},"stands":{"bytes":6737,"decodedBytes":16384,"decodedSha256":"01c60b24d5bc2b19ee914ff01fd14de